{
  "schemaVersion": "source-resolution.v1",
  "input": {"kind": "link", "value": "https://www.youtube.com/watch?v=dQw4w9WgXcQ"},
  "resolverId": "youtube_podcast_match",
  "candidates": [
    {
      "id": "youtube_podcast_match:channel-UCuAXFkgsw1L7xaCfnd5JJOw",
      "kind": "website",
      "contentKind": "video",
      "title": "Rick Astley",
      "websiteURL": "https://www.youtube.com/@RickAstleyYT",
      "confidence": "possible",
      "reason": "Found the channel, but no podcast feed publishes this video",
      "resolverId": "youtube_podcast_match",
      "externalIds": {"youtubeChannelId": "UCuAXFkgsw1L7xaCfnd5JJOw"}
    }
  ]
}
